 Datum;01.03.11;02.03.11;03.03.11;04.03.11;05.03.11;06.03.11;07.03.11;08.03.11;09.03.11;10.03.11;11.03.11;12.03.11;13.03.11;14.03.11;15.03.11;16.03.11;17.03.11;18.03.11;19.03.11;20.03.11;21.03.11;22.03.11;23.03.11;24.03.11;25.03.11;26.03.11;27.03.11;28.03.11;29.03.11;30.03.11;31.03.11
Bagel Cream Cheese here;1;3;2;5;5;4;2;0;3;1;4;4;1;0;1;1;1;2;3;0;1;1;0;0;3;4;0;2;0;0;0
Bagel Cream Cheese to go;2;1;1;2;1;0;2;2;2;1;1;0;0;1;1;1;2;1;0;0;3;2;3;2;1;0;0;1;0;1;1
Bagel Fitness here;3;6;2;4;8;3;4;2;5;3;4;8;1;6;3;5;5;5;12;2;7;4;7;5;3;1;5;2;5;3;5
Bagel Fitness to go;1;0;1;0;4;2;0;3;0;5;0;0;1;0;1;5;0;0;2;2;0;2;3;1;3;0;0;2;0;2;0
Bagel Green Garden here;0;1;0;1;0;0;1;3;2;0;0;3;0;1;0;1;5;0;3;2;3;2;0;1;0;2;0;4;2;0;0
Bagel Green Garden to go;0;1;0;0;0;0;0;2;0;2;0;0;0;0;0;5;0;0;0;0;1;0;0;0;0;1;0;0;1;0;0
Bagel India here;0;0;0;3;1;0;0;1;2;0;4;2;1;2;1;0;0;2;2;1;0;1;0;2;1;2;2;1;0;1;0
Bagel Mexico here;1;0;1;1;4;0;3;2;4;0;1;1;0;2;1;0;1;2;3;2;1;3;1;0;3;5;5;2;3;2;1
Bagel Mexico to go;0;0;0;0;0;0;0;0;0;0;0;1;0;0;0;0;0;0;0;0;0;0;4;0;0;0;0;0;1;0;0
Bagel Morning Star here;4;2;0;2;2;0;4;2;1;2;0;2;1;2;0;2;1;3;1;0;3;0;3;0;0;0;0;1;1;0;0
Bagel Morning Star to go;0;0;0;0;0;0;0;0;0;0;0;0;0;0;0;0;0;0;0;0;0;0;0;0;0;0;0;1;0;0;0
Bagel Peanut Butter here;0;1;1;2;0;0;1;0;0;0;0;1;0;0;0;0;0;0;2;0;0;0;0;0;0;1;0;0;0;0;0
Bagel plain here;2;1;1;1;1;2;0;0;1;2;5;2;1;1;1;1;4;3;3;0;0;0;1;1;7;0;1;0;1;0;2
Bagel plain to go;0;2;4;3;5;1;2;0;2;2;1;1;0;0;1;5;0;5;0;1;3;0;0;1;1;1;0;2;5;8;3
Bagel Roma oder Florenz here;10;9;8;9;16;2;7;4;11;13;8;13;6;9;5;11;10;11;17;6;13;8;7;4;10;16;8;4;9;7;9
Bagel Roma oder Florenz to go;4;1;4;1;4;2;1;7;5;5;1;7;0;0;3;11;2;4;0;6;0;5;6;6;5;1;1;4;3;5;0
Bagel Stulle Deluxe here;3;7;3;3;6;2;4;2;3;4;3;3;2;3;1;7;2;3;6;3;10;4;2;3;4;3;2;3;1;1;3
Bagel Stulle Deluxe to go;0;0;1;1;4;1;1;4;0;5;1;0;0;0;2;4;0;2;0;0;2;0;3;0;2;1;3;0;2;3;1
Bagel Vital here;1;0;0;0;0;0;0;0;0;0;0;0;0;0;0;1;0;2;0;0;3;0;0;0;0;0;0;0;1;1;0
Bagel Vital to go;0;0;0;0;0;0;0;0;0;0;0;0;0;0;0;0;0;0;0;0;1;0;0;0;0;0;0;0;1;0;0
Brezel Butter here;0;1;1;2;1;0;0;0;1;0;2;1;0;0;1;3;1;1;1;0;0;0;0;1;3;0;1;1;1;0;0
Brezel plain here;5;2;4;0;3;2;3;1;1;3;2;4;1;3;1;0;4;2;5;1;0;1;2;1;3;3;1;2;0;4;7
Brezel plain to go;1;1;0;0;2;0;0;2;1;0;2;0;0;1;0;0;1;0;0;1;2;0;2;1;0;1;1;0;2;0;1
Cafe Creme groﬂ  here;4;6;3;2;9;5;4;2;5;3;5;6;9;0;2;4;6;1;6;4;4;1;3;1;6;5;7;4;2;1;6
Cafe Creme groﬂ  to go;4;2;4;3;4;6;3;6;3;3;2;8;1;1;3;2;2;1;4;4;3;3;3;6;3;4;6;1;7;5;0
Cafe Creme klein  here;15;14;11;10;10;4;10;12;13;23;13;15;8;14;11;12;23;8;23;10;16;15;11;14;14;10;4;11;12;13;11
Cafe Creme klein  to go;6;1;8;4;8;1;5;7;9;5;2;15;4;7;4;1;5;5;5;1;4;8;6;4;9;5;2;5;7;6;3
Caffe Latte mit Sirup here;6;1;4;6;7;5;4;2;2;3;5;3;0;2;2;2;5;1;0;1;1;2;0;2;2;5;2;1;0;2;3
Caffe Latte mit Sirup to go;1;1;1;6;4;2;5;2;2;1;0;5;1;0;5;0;1;3;5;2;2;1;6;0;2;2;5;1;1;0;5
Caffe Latte ohne Sirup bring in;0;0;0;0;0;0;0;0;0;0;0;0;0;0;1;0;0;0;0;0;0;0;0;0;0;0;0;0;0;0;0
Caffe Latte ohne Sirup here;32;12;14;20;33;17;14;8;24;22;21;31;18;15;9;20;18;21;22;12;7;11;14;21;20;19;11;19;12;23;13
Caffe Latte ohne Sirup to go;7;8;7;16;23;11;11;13;12;11;7;28;6;13;16;10;7;6;19;18;13;19;16;12;12;13;17;12;18;13;5
Cappuccino groﬂ  here;11;10;14;10;23;5;9;9;14;7;21;17;12;2;4;8;10;17;20;12;6;10;12;9;11;21;8;10;15;9;8
Cappuccino groﬂ  to go;5;6;5;11;19;9;11;14;7;5;7;9;6;11;10;2;6;7;11;13;6;11;14;11;6;10;9;4;8;6;7
Cappuccino klein  here;23;15;19;18;18;10;21;13;14;16;24;19;13;21;20;20;21;16;35;14;17;9;9;15;11;18;8;17;18;22;21
Cappuccino klein  to go;5;6;5;3;9;2;14;9;2;6;7;11;4;2;11;3;5;5;14;11;3;13;8;10;11;5;7;11;13;4;4
Chai Tea groﬂ Chai Banana here;1;0;0;3;0;0;1;0;3;4;1;1;0;0;1;0;1;2;0;1;1;1;1;0;1;4;1;1;0;2;0
Chai Tea groﬂ Chai Banana to go;1;0;0;0;4;1;2;0;0;0;1;1;1;0;0;0;0;0;0;1;0;0;1;1;0;1;0;0;0;0;0
Chai Tea groﬂ Chai Chocolate here;0;0;0;0;0;0;0;0;0;0;0;0;1;0;0;0;0;0;0;0;0;0;0;0;2;0;0;0;0;0;0
Chai Tea groﬂ Chai Tea Latte bring in;0;0;0;0;0;0;0;0;0;0;0;0;1;0;0;0;0;0;0;0;0;0;0;0;0;0;0;0;0;0;0
Chai Tea groﬂ Chai Tea Latte here;6;11;9;5;13;8;8;8;7;13;8;15;6;5;3;7;9;12;15;7;5;4;6;8;6;7;4;6;3;6;4
Chai Tea groﬂ Chai Tea Latte to go;1;2;3;5;13;3;5;4;2;0;0;15;4;1;0;0;3;3;4;7;3;5;4;4;5;3;4;1;5;1;2
Chai Tea klein Chai Banana here;0;0;0;0;1;0;1;0;0;0;0;0;0;0;0;0;0;0;0;0;0;0;0;0;0;0;0;0;0;0;0
Chai Tea klein Chai Tea Latte here;1;7;4;5;11;1;5;3;10;8;6;5;3;2;2;4;6;5;9;2;4;3;4;3;6;5;1;4;2;4;6
Chai Tea klein Chai Tea Latte to go;2;1;2;2;3;0;1;2;1;2;0;2;0;3;0;0;3;1;2;3;1;4;7;1;4;3;5;0;0;1;1
Chocolate groﬂ Bio-Kakao here;1;0;0;0;0;0;0;0;3;0;0;0;0;1;0;0;0;0;0;1;0;0;0;2;0;0;0;0;0;0;1
Chocolate groﬂ Bio-Kakao to go;0;0;0;0;0;0;0;0;0;0;0;0;0;0;0;0;0;0;0;0;0;0;0;0;0;1;0;0;1;0;0
Chocolate groﬂ black here;6;5;4;6;5;7;3;7;6;8;1;4;2;1;0;4;3;5;3;3;4;0;2;3;2;5;2;0;2;3;5
Chocolate groﬂ black to go;3;2;1;0;5;2;3;1;0;0;0;3;2;0;1;1;1;2;0;4;2;2;0;0;0;2;2;2;3;0;0
Chocolate groﬂ Marshmallow Chocolate here;1;1;1;0;2;1;1;2;0;0;0;0;2;0;0;0;0;1;0;2;0;0;0;1;0;2;1;0;0;0;0
Chocolate groﬂ Marshmallow Chocolate to go;0;1;0;0;0;0;0;0;0;0;0;0;0;0;0;0;0;0;0;0;0;0;0;0;0;0;1;0;0;0;0
Chocolate groﬂ white here;3;2;3;3;0;2;2;1;0;1;2;0;0;0;1;0;0;2;0;0;0;0;1;0;0;1;0;1;0;1;0
Chocolate groﬂ white to go;0;2;0;2;2;2;0;1;1;0;2;2;1;0;2;0;0;0;1;3;1;0;1;2;1;1;1;0;0;0;0
Chocolate klein Bio-Kakao here;0;0;0;0;3;1;0;0;1;1;1;1;0;0;1;0;0;1;0;0;0;0;0;0;0;0;0;0;1;0;0
Chocolate klein Bio-Kakao to go;0;0;0;0;1;0;3;0;0;0;0;0;0;0;0;0;0;0;0;0;0;0;0;0;0;0;0;0;1;0;0
Chocolate klein black here;2;7;11;2;12;5;2;8;2;4;4;3;5;3;3;4;4;9;9;6;2;3;3;3;5;7;3;1;1;6;3
Chocolate klein black to go;1;1;3;3;7;0;2;0;0;1;4;2;0;1;3;0;0;0;4;3;2;0;1;3;0;2;0;2;1;1;0
Chocolate klein white here;1;0;2;3;0;1;4;2;2;2;5;3;0;2;0;2;1;1;1;0;0;1;0;0;2;2;0;1;0;1;1
Chocolate klein white to go;0;0;0;0;3;0;3;1;0;0;0;2;0;0;1;1;0;0;0;2;1;0;0;0;1;0;0;0;1;0;0
Cookie here;10;8;7;13;14;4;5;2;6;5;11;9;9;4;7;12;7;4;12;7;4;5;3;3;8;10;4;5;5;6;10
Cookie to go;6;9;5;8;7;3;3;2;2;3;2;5;5;3;4;5;4;3;3;3;3;5;11;6;5;5;5;4;4;3;4
Cool Latte Iced Caffe here;0;0;0;1;0;0;1;0;1;0;0;0;1;1;4;0;0;2;2;0;0;0;0;0;0;0;0;0;1;1;0
Cool Latte Iced Caffe to go;0;0;0;0;0;0;0;1;0;0;0;0;0;2;8;0;0;0;3;1;1;4;4;5;2;1;0;0;5;0;0
Cool Latte Iced Espresso here;0;0;1;1;0;0;0;1;0;0;0;1;1;0;1;0;1;0;0;0;0;1;0;0;0;1;0;3;2;0;0
Cool Latte Iced Espresso to go;0;0;0;0;1;0;0;0;1;0;0;1;0;0;0;0;0;0;0;0;0;0;0;2;0;0;0;2;0;0;0
Cool Latte Iced Macchiato here;0;1;1;0;1;0;0;0;0;1;1;5;4;2;3;3;1;0;1;0;2;1;2;1;3;0;0;2;2;1;1
Cool Latte Iced Macchiato to go;1;0;0;2;1;0;0;3;0;4;0;5;0;0;5;0;0;0;0;5;0;3;6;2;4;0;0;2;5;1;0
Donut here;9;11;5;13;13;16;7;14;11;9;8;10;8;4;4;5;3;1;8;7;1;4;8;2;6;11;3;6;5;9;5
Donut to go;1;2;6;6;10;8;2;5;2;1;5;9;9;9;5;4;2;2;7;6;5;5;2;9;1;6;14;5;9;1;4
Eiskaffee here;2;0;1;2;1;0;0;4;3;2;1;16;0;1;8;0;1;0;3;1;0;0;2;4;10;2;4;2;4;2;0
Eiskaffee to go;0;0;0;0;2;0;0;0;0;0;0;3;0;0;7;0;0;1;0;3;2;8;3;11;2;0;2;2;6;0;0
Eisschokolade here;3;0;0;3;2;3;0;2;7;2;1;4;1;1;2;2;2;0;4;1;2;2;5;0;6;5;3;0;2;1;2
Eisschokolade to go;0;0;0;0;0;0;0;0;0;0;0;1;0;9;2;0;1;0;1;2;0;3;2;5;3;1;0;0;8;0;0
Eistee here;0;1;3;2;3;3;1;3;3;0;1;2;1;0;2;2;1;1;0;0;2;3;2;1;4;3;0;3;1;2;1
Eistee to go;1;0;0;0;1;0;1;0;0;1;0;5;0;1;0;0;0;0;1;0;0;0;0;0;1;1;0;1;2;0;0
Espresso groﬂ Barista here;1;0;0;0;0;0;0;0;0;0;0;1;1;0;1;1;0;0;1;1;0;0;1;1;0;0;0;0;1;0;0
Espresso groﬂ Barista to go;0;0;0;0;0;0;0;0;0;0;0;0;0;0;0;0;0;0;0;0;0;0;2;1;0;0;0;0;0;0;0
Espresso groﬂ Cuba here;0;0;0;0;1;3;0;0;0;1;0;0;1;0;1;1;0;3;0;0;1;0;0;0;0;2;0;0;0;0;0
Espresso groﬂ Cuba to go;0;0;1;0;0;0;1;0;0;0;0;0;0;0;0;0;0;0;0;0;0;0;0;0;0;0;0;0;0;0;0
Espresso groﬂ Lungo here;0;0;0;0;0;0;0;0;0;1;0;0;0;0;0;0;0;0;0;0;0;0;0;0;0;0;0;1;0;0;0
Espresso groﬂ Lungo to go;0;1;0;0;0;0;0;0;0;0;0;0;0;0;0;0;0;0;0;0;0;0;0;0;0;0;0;0;0;0;0
Espresso groﬂ Macchiato here;2;0;0;1;1;0;2;0;0;1;0;1;0;1;2;1;1;0;0;0;0;0;0;1;3;0;2;0;1;0;0
Espresso groﬂ Macchiato to go;0;0;0;0;0;0;0;0;0;0;0;0;0;0;1;0;0;0;0;0;2;1;0;1;2;0;0;0;0;0;0
Espresso groﬂ Originale here;1;3;4;0;3;0;2;2;1;1;1;1;1;2;1;3;0;2;1;4;0;3;4;2;4;1;0;3;2;1;1
Espresso groﬂ Originale to go;0;1;1;1;0;0;0;1;0;0;0;0;0;0;0;0;0;0;0;0;0;0;0;0;0;1;0;1;0;0;0
Espresso groﬂ Unplugged here;2;0;0;1;1;0;3;2;0;0;0;0;0;0;0;0;0;0;0;0;0;0;0;0;0;0;0;0;1;0;1
Espresso groﬂ Unplugged to go;0;0;0;1;0;0;0;0;0;0;0;0;0;0;1;0;0;0;0;1;0;0;0;0;0;0;0;0;0;0;0
Espresso klein Barista here;0;1;2;0;1;3;1;1;0;1;0;0;0;1;2;1;0;0;0;0;2;1;0;2;0;0;0;2;0;0;0
Espresso klein Cuba here;2;0;0;1;0;0;1;1;2;0;1;0;0;1;3;2;0;0;0;0;3;2;0;1;1;1;0;0;0;0;3
Espresso klein Cuba to go;0;0;0;0;1;0;0;0;0;0;0;0;0;0;0;0;0;0;0;0;0;0;0;0;0;0;1;0;0;0;0
Espresso klein Lungo here;0;0;0;0;0;0;0;0;0;0;2;0;0;1;0;0;0;0;1;0;0;0;0;0;1;0;0;0;0;0;0
Espresso klein Lungo to go;0;0;0;0;0;0;0;0;0;0;0;0;0;0;0;0;0;0;1;0;0;0;0;1;0;0;0;0;1;0;0
Espresso klein Macchiato here;1;1;3;3;4;1;6;3;1;0;4;2;0;2;3;3;0;3;1;0;4;2;1;0;2;3;1;2;1;0;0
Espresso klein Macchiato to go;1;0;0;0;0;0;0;1;0;3;0;0;0;1;0;1;1;0;1;0;0;0;0;0;0;0;0;0;1;0;0
Espresso klein Orange here;0;2;1;0;2;2;0;1;0;0;0;1;0;0;0;2;0;0;1;1;0;0;0;1;0;2;1;0;1;0;1
Espresso klein Orange to go;0;0;0;0;0;0;1;0;0;0;0;0;0;0;1;0;0;0;0;0;0;0;0;0;0;0;0;0;0;0;0
Espresso klein Originale here;4;5;3;3;4;1;2;3;3;1;5;8;4;3;8;0;4;1;4;4;2;5;7;5;1;6;3;7;6;7;8
Espresso klein Originale to go;0;0;0;0;0;0;0;1;1;0;0;1;0;0;1;0;2;0;1;1;1;0;2;0;1;0;0;0;0;0;0
Espresso klein Unplugged here;0;0;0;1;2;0;0;0;0;1;4;1;0;1;1;0;1;1;0;1;0;1;0;0;1;2;1;1;1;0;0
Espresso klein Unplugged to go;0;0;0;0;0;0;0;0;0;0;0;0;1;0;0;0;0;0;1;0;0;0;0;0;0;0;0;0;0;0;0
Espresso Latte here;1;3;7;6;8;3;2;0;4;5;3;7;1;3;4;5;1;4;5;5;3;6;7;6;4;5;5;9;2;3;2
Espresso Latte to go;1;2;0;1;4;0;1;1;0;1;0;1;1;1;1;1;0;1;0;1;2;0;0;1;0;1;0;1;1;0;1
Frappe black here;0;1;1;1;1;0;2;0;0;1;3;1;0;0;3;0;0;0;3;4;1;2;0;0;0;0;0;0;0;0;0
Frappe black to go;0;0;0;2;1;0;4;0;1;0;0;7;2;1;6;0;1;0;3;1;0;0;0;1;0;1;0;0;0;0;0
Frappe white here;0;0;0;0;0;2;0;1;1;1;0;0;0;2;3;1;0;1;3;0;0;2;3;2;2;4;1;0;1;0;3
Frappe white to go;1;2;0;1;1;0;0;0;1;1;0;3;1;0;1;0;0;0;0;2;0;1;1;3;6;1;1;3;3;0;0
Fruchtsaft frisch groﬂ  here;0;0;0;0;1;0;0;1;0;1;0;0;1;0;0;2;0;0;2;0;1;0;0;0;1;0;0;0;0;0;4
Fruchtsaft frisch groﬂ  to go;0;0;0;1;0;0;0;0;0;0;0;0;0;0;0;0;1;0;0;0;0;0;0;1;0;0;0;0;0;0;0
Fruchtsaft frisch klein  here;0;0;0;1;0;0;2;1;0;2;1;1;0;1;1;1;2;0;2;0;3;1;1;0;1;2;0;1;1;1;2
Fruchtsaft frisch klein  to go;0;0;0;0;0;0;0;0;1;0;0;0;0;0;0;0;0;0;0;1;1;0;0;1;0;0;1;0;0;0;0
Heiﬂe S‰fte Heiﬂe Orange here;0;1;0;0;1;1;0;0;0;0;0;2;0;0;0;0;0;0;0;0;0;0;0;0;0;0;0;0;0;1;0
Heiﬂe S‰fte Heiﬂe Orange to go;0;0;0;0;0;1;0;0;0;0;0;0;0;1;0;0;0;0;0;0;0;0;0;0;0;0;0;0;0;0;0
Heiﬂe S‰fte Heiﬂe Zitrone here;1;0;0;0;2;0;1;0;2;0;0;0;0;0;0;0;0;0;1;0;0;0;0;1;0;0;0;0;1;0;0
Heiﬂe S‰fte Heiﬂe Zitrone to go;0;0;0;0;0;0;1;0;0;1;0;0;0;0;0;0;0;0;0;0;0;0;0;0;0;0;0;0;0;0;0
Heiﬂe S‰fte Heiﬂer Apfel here;0;0;0;1;0;0;0;0;0;0;0;1;0;1;0;1;0;0;0;0;2;0;0;0;0;1;0;0;0;0;0
Heiﬂe S‰fte Heiﬂer Apfel to go;0;0;0;0;0;0;0;1;0;0;0;0;0;0;0;0;0;0;0;0;0;0;0;0;0;0;0;0;0;1;0
Iced Chai Latte here;2;1;1;0;0;0;0;0;2;0;0;1;3;1;3;0;2;0;1;1;0;0;2;0;2;1;1;0;1;2;0
Iced Chai Latte to go;1;0;0;0;2;0;2;0;0;0;0;6;0;0;4;0;0;0;0;1;3;5;1;1;3;0;3;3;3;1;0
Iced Espresso to go;0;0;0;0;0;0;0;0;0;0;0;0;0;0;0;0;0;0;0;0;0;0;0;0;0;0;0;0;1;0;0
Kaffee here;14;7;17;6;13;4;7;8;12;9;10;16;2;20;12;7;8;5;11;9;12;13;5;13;14;9;4;16;7;9;11
Kaffee to go;1;4;2;7;6;1;5;2;7;3;1;1;3;8;7;5;1;3;4;8;1;7;7;6;6;3;2;6;6;5;3
Kaffeeverkauf Espressobohnen groﬂ Espresso Barista to go;0;0;0;0;0;0;0;0;0;0;0;0;0;0;0;0;0;0;0;0;0;0;0;0;0;0;0;0;0;1;0
Kaffeeverkauf Espressobohnen groﬂ Espresso Cuba to go;0;0;0;0;0;0;0;0;0;0;0;0;0;0;0;0;0;0;0;0;0;1;0;0;0;0;0;0;0;0;0
Kaffeeverkauf Espressobohnen groﬂ Espresso Originale to go;0;0;0;1;0;0;0;0;0;1;0;0;0;1;0;0;0;0;0;0;0;0;0;0;0;0;0;0;0;0;0
Kaffeeverkauf Espressobohnen groﬂ Unplugged here;1;0;0;0;0;0;0;0;0;0;0;0;0;0;0;0;0;0;0;0;0;0;0;0;0;0;0;0;0;0;0
Kaffeeverkauf Espressobohnen groﬂ Unplugged to go;0;0;0;0;0;0;0;0;0;0;0;0;0;0;0;0;1;0;1;0;0;0;0;0;0;0;0;0;0;0;0
Kaffeeverkauf Espressobohnen klein Espresso Barista to go;0;0;0;0;0;0;0;0;0;0;0;0;0;0;0;0;0;0;0;0;0;0;0;0;0;0;0;0;1;0;0
Kaffeeverkauf Espressobohnen klein Espresso Cuba to go;0;0;0;0;0;1;0;0;1;0;0;0;0;0;1;0;0;0;0;0;1;0;0;0;0;0;0;0;2;0;0
Kaffeeverkauf Espressobohnen klein Espresso Originale to go;0;0;0;0;2;1;0;0;1;0;0;1;0;1;0;0;0;0;0;0;0;0;0;0;0;1;0;0;0;0;0
Kaffeeverkauf Espressobohnen klein Unplugged here;0;0;0;0;0;0;0;0;0;0;1;0;0;0;0;0;0;0;0;0;0;0;0;0;0;0;0;0;0;0;0
Kaffeeverkauf Espressobohnen klein Unplugged to go;0;0;0;0;0;0;1;0;0;0;0;0;0;0;0;0;0;0;0;0;1;1;0;0;0;0;0;0;0;0;0
Kaffeeverkauf Goldline Australian to go;0;0;0;1;0;0;0;0;0;0;0;0;0;0;0;0;0;0;0;0;0;0;0;0;0;0;0;0;0;0;0
Kaffeeverkauf Goldline Blue Mountain here;0;0;0;0;1;0;0;0;0;0;0;0;0;0;0;0;0;0;0;0;0;0;0;0;0;0;0;0;0;0;0
Kaffeeverkauf Goldline Blue Mountain to go;1;0;0;0;0;0;0;0;0;0;0;0;0;0;0;1;0;0;0;0;0;2;0;0;0;0;0;0;0;0;0
Kaffeeverkauf Goldline Galapagos here;0;0;0;0;1;0;0;0;0;0;0;0;0;0;0;0;0;0;0;0;0;0;0;0;0;0;0;0;0;0;0
Kaffeeverkauf sortenrein groﬂ ƒthiopischer Mocca to go;0;0;0;0;0;0;0;1;0;0;0;0;0;1;0;0;0;0;0;0;0;0;0;0;0;0;0;0;0;0;0
Kaffeeverkauf sortenrein groﬂ Kenya Arabica AA to go;0;0;0;0;0;0;1;0;0;0;0;1;0;0;0;0;0;0;0;0;0;0;0;0;0;0;0;0;0;0;0
Kaffeeverkauf sortenrein groﬂ Mexiko Organico to go;0;0;0;0;0;0;0;0;0;0;0;0;0;0;0;0;0;0;0;0;1;0;0;0;0;0;0;0;0;0;0
Kaffeeverkauf sortenrein klein ƒthiopischer Mocca here;0;0;0;0;1;0;0;0;0;0;0;0;0;0;1;0;0;0;0;0;0;0;0;0;0;0;0;0;0;0;0
Kaffeeverkauf sortenrein klein ƒthiopischer Mocca to go;0;0;0;0;0;0;0;0;0;0;1;1;0;0;0;0;0;0;0;0;0;1;0;0;0;0;0;0;0;0;0
Kaffeeverkauf sortenrein klein Costa Rica to go;0;0;0;0;0;0;0;0;0;0;0;0;0;0;0;0;0;0;0;0;0;1;0;0;1;0;0;0;0;0;0
Kaffeeverkauf sortenrein klein Guatemala to go;0;0;0;0;0;0;0;0;0;0;0;0;0;0;0;0;0;0;0;0;0;1;0;0;0;0;0;0;0;0;0
Kaffeeverkauf sortenrein klein Kenya Arabica AA to go;0;0;0;0;0;0;0;1;0;0;0;0;0;0;0;0;0;0;0;0;0;1;0;0;0;0;0;0;0;0;0
Kaffeeverkauf sortenrein klein Mexiko Organico here;0;0;0;0;0;0;0;0;0;0;0;0;0;0;0;0;0;1;0;0;0;0;0;0;0;0;0;0;0;0;0
Kaffeeverkauf sortenrein klein Mexiko Organico to go;0;0;0;1;0;0;0;0;0;0;0;0;0;0;0;0;0;0;0;0;0;0;0;0;0;0;0;0;0;0;0
Kaffegetr‰nk groﬂ ƒthiopischer Mocca here;0;0;0;0;1;0;0;0;0;0;0;0;0;0;0;0;0;0;0;0;0;0;0;0;0;0;0;0;0;0;0
Kaffegetr‰nk groﬂ Costa Rica here;0;0;0;0;0;0;0;0;0;0;0;0;0;0;0;0;0;0;0;0;1;0;0;1;0;1;0;0;0;0;0
Kaffegetr‰nk groﬂ Guatemala here;0;0;0;0;0;0;0;0;0;0;0;1;0;0;0;0;0;0;0;0;0;0;0;0;0;0;0;0;0;0;0
Kaffegetr‰nk groﬂ Mexiko Organico here;0;0;0;1;2;2;1;1;0;0;1;1;1;0;0;0;0;2;0;0;0;0;2;0;1;0;0;0;1;0;0
Kaffegetr‰nk groﬂ Peru here;0;0;0;0;0;0;0;0;0;0;0;0;0;1;1;0;0;0;0;1;0;0;0;0;0;0;0;0;0;0;0
Kaffegetr‰nk groﬂ Wiener Melange here;0;0;0;0;0;0;0;0;0;0;1;0;0;0;0;0;0;0;0;0;0;0;0;0;0;0;0;0;0;0;0
Kaffegetr‰nk klein ƒthiopischer Mocca here;0;0;0;0;0;0;0;0;0;0;0;0;0;0;0;0;0;0;2;0;0;0;0;0;0;0;0;0;0;0;0
Kaffegetr‰nk klein ƒthiopischer Mocca to go;0;0;0;0;0;0;0;0;0;0;0;1;0;0;0;0;0;0;0;0;0;0;0;0;0;0;0;0;0;0;0
Kaffegetr‰nk klein India Malabar to go;0;0;0;0;0;0;0;0;0;0;0;0;0;0;0;0;0;0;0;0;1;0;0;0;0;0;0;0;0;0;0
Kaffegetr‰nk klein Kenya Arabica AA to go;0;0;0;0;0;1;0;0;0;0;0;0;0;0;0;0;0;0;0;0;0;0;0;0;0;0;0;0;0;0;0
Kaffegetr‰nk klein Mexiko Organico here;0;0;0;0;0;0;0;0;1;1;0;0;0;0;3;0;1;0;0;0;0;0;0;1;0;0;0;0;1;0;0
Kaffegetr‰nk klein Wiener Melange here;1;0;1;0;0;0;0;0;0;0;0;0;0;0;1;0;0;0;0;0;0;0;0;0;0;0;0;0;1;0;0
Kaffeverkauf Hausmischung groﬂ Cafe Creme to go;0;0;0;0;1;0;0;0;0;0;1;0;0;0;0;0;0;0;0;0;0;0;0;0;0;0;0;0;0;0;0
Kaffeverkauf Hausmischung groﬂ Wiener Melange to go;0;0;0;0;0;0;0;0;0;0;0;0;0;0;0;1;0;0;0;0;0;0;0;0;0;0;0;0;0;0;0
Kaffeverkauf Hausmischung klein Cafe Creme here;0;0;0;0;0;0;1;0;0;0;0;0;0;0;0;0;0;0;0;0;0;0;0;0;0;0;0;0;0;0;0
Kaffeverkauf Hausmischung klein Cafe Creme to go;0;0;0;0;1;0;0;1;0;0;0;0;0;0;0;0;0;0;0;0;0;0;0;0;1;0;0;0;0;0;0
Kaffezusatz Espresso Shot here;0;0;0;1;3;0;0;0;1;0;1;1;3;0;4;0;1;0;2;0;1;2;0;0;0;0;2;1;0;1;0
Kaffezusatz Espresso Shot to go;0;1;0;1;1;0;0;1;0;1;0;1;0;2;1;1;0;0;0;2;1;0;0;1;1;1;1;0;1;0;0
Kaffezusatz Flavour Shot here;2;0;3;2;3;0;0;0;8;2;5;2;5;0;2;3;1;3;8;4;4;0;1;0;0;4;5;3;1;1;0
Kaffezusatz Flavour Shot to go;0;0;1;2;4;3;1;4;1;3;0;8;2;4;3;1;0;0;2;4;5;6;4;3;0;1;0;1;1;1;0
Kaffezusatz Lac.-frei here;11;5;4;6;6;1;8;4;4;4;2;3;4;4;5;4;2;9;9;2;5;4;4;2;6;6;5;5;6;7;0
Kaffezusatz Lac.-frei to go;5;3;0;4;6;2;3;2;0;1;3;4;0;3;5;2;2;1;6;4;3;3;2;2;5;5;3;4;1;0;1
Kaffezusatz Sahne here;1;2;3;1;2;0;2;3;4;0;5;3;0;0;0;0;1;1;2;1;1;1;0;1;0;3;2;1;0;1;0
Kaffezusatz Sahne to go;0;0;0;0;0;0;0;0;0;0;0;1;0;0;1;0;0;0;1;0;0;1;1;1;1;0;1;1;0;0;0
Kaffezusatz Soja here;5;12;6;3;6;7;4;3;7;4;7;9;4;3;6;1;7;4;5;2;1;4;2;1;0;5;5;3;5;6;3
Kaffezusatz Soja to go;0;1;2;3;6;3;1;0;1;2;2;6;0;2;1;0;0;2;6;11;1;5;5;3;4;6;2;3;3;1;1
Kapuziner groﬂ  here;0;1;0;0;0;0;0;1;0;0;0;0;1;0;0;0;1;2;1;0;1;0;1;1;0;1;0;0;0;1;0
Kapuziner groﬂ  to go;0;0;0;0;1;0;0;0;0;0;0;0;0;0;0;1;0;0;0;0;0;0;1;0;0;0;0;0;0;0;0
Kapuziner klein  here;1;0;0;2;2;0;1;1;0;1;3;0;0;0;2;1;1;1;0;0;1;1;0;0;1;3;1;0;0;0;1
Kapuziner klein  to go;0;0;0;0;1;0;0;0;0;0;0;1;0;0;0;0;0;0;0;0;0;0;0;1;0;0;0;0;0;0;1
Kuchen here;1;0;0;0;23;15;0;0;2;0;0;25;16;0;0;0;0;0;25;12;3;0;1;0;0;16;15;4;0;0;0
Kuchen to go;1;0;0;0;1;2;1;0;0;0;0;2;0;0;0;0;0;0;0;3;0;0;1;0;0;0;2;2;0;0;0
Latte Macchiato mit Sirup here;11;21;17;13;22;17;21;14;19;17;16;13;10;10;9;16;13;19;23;16;17;6;5;9;18;21;12;8;6;15;8
Latte Macchiato mit Sirup to go;11;7;10;18;19;18;10;9;10;10;6;22;7;5;11;12;5;10;15;19;13;5;22;8;11;14;10;7;5;10;3
Latte Macchiato ohne Sirup here;34;31;34;38;55;17;35;20;29;44;41;38;23;24;31;28;31;36;68;25;26;21;20;21;28;45;27;29;35;31;29
Latte Macchiato ohne Sirup to go;19;21;13;17;36;8;22;27;9;17;22;43;13;22;28;22;14;14;27;32;24;23;27;19;31;20;12;20;22;13;8
Milk groﬂ  here;0;0;0;1;0;1;0;0;0;1;0;1;0;0;1;0;1;0;1;0;1;1;0;0;0;0;0;0;0;0;0
Milk groﬂ  to go;1;0;0;0;0;0;0;0;1;0;0;0;0;0;0;0;0;0;0;0;0;0;1;0;0;0;0;0;0;0;0
Milk klein  here;0;1;2;1;0;0;0;1;0;0;0;0;0;0;0;0;1;0;0;0;0;0;0;0;0;0;0;0;0;1;0
Milk klein  to go;0;0;0;0;0;0;0;0;0;0;0;0;1;1;0;0;1;0;0;0;0;0;0;0;0;0;0;0;0;0;0
Mocca groﬂ black here;1;2;3;5;2;1;4;2;4;4;0;3;5;1;5;1;3;1;4;2;4;2;0;2;7;4;6;0;1;1;2
Mocca groﬂ black to go;1;1;4;2;3;3;1;1;2;0;1;4;0;0;1;0;1;0;3;6;1;0;0;1;2;1;5;3;1;1;0
Mocca groﬂ white here;3;2;2;4;4;5;0;1;1;5;5;2;1;2;1;2;0;4;3;3;0;2;5;0;7;5;2;4;1;1;3
Mocca groﬂ white to go;0;1;0;5;8;3;5;6;2;1;3;9;0;2;1;2;1;1;3;6;3;3;4;4;4;0;3;0;1;1;1
Mocca klein black here;3;4;2;3;2;3;2;0;5;2;5;3;1;2;8;2;1;3;6;0;3;2;1;2;3;2;4;3;2;2;0
Mocca klein black to go;3;1;2;1;2;2;1;0;0;1;2;9;0;0;2;0;0;0;2;1;0;1;0;0;0;2;3;1;1;1;0
Mocca klein white here;2;2;3;3;2;2;1;2;1;2;1;1;0;1;1;4;6;4;3;2;2;1;4;2;2;7;4;3;3;4;1
Mocca klein white to go;3;0;1;1;3;0;3;1;0;1;0;0;0;0;0;1;1;0;3;2;1;2;3;1;0;1;5;1;1;0;0
MoccaSin here;0;1;0;0;2;0;0;0;0;0;1;3;0;1;0;1;1;0;2;2;0;0;0;0;3;3;0;0;1;0;2
MoccaSin to go;1;2;1;0;3;1;0;0;1;0;0;1;0;0;1;0;0;1;2;4;0;0;0;0;0;0;1;0;0;0;0
Muffin bring in;0;0;0;0;0;0;0;0;0;0;0;0;2;0;0;0;0;0;0;0;0;0;0;0;0;0;0;0;0;0;0
Muffin here;27;31;24;31;42;42;42;43;35;26;39;31;19;20;21;27;24;20;36;31;20;19;15;17;35;49;25;29;17;21;20
Muffin to go;8;12;10;22;23;13;14;7;9;6;10;18;14;2;11;32;13;11;16;31;12;13;20;11;22;8;10;7;7;7;15
M¸sli here;0;2;1;1;0;1;0;0;0;1;0;0;0;0;1;1;1;0;1;0;0;0;1;0;0;1;1;1;0;0;0
M¸sli to go;0;0;0;0;0;0;0;0;0;0;0;0;0;0;1;0;0;4;0;0;1;0;0;0;0;0;0;0;1;0;0
Nebenprodukte MoccaSin Chocolate white to go;1;0;0;0;1;0;1;0;0;0;0;0;0;0;0;0;0;0;0;0;0;0;0;0;0;0;0;0;0;0;0
Nebenprodukte Sirup groﬂ here;0;0;0;0;0;0;0;0;0;0;0;0;0;0;0;0;0;0;0;0;0;1;0;0;0;0;0;0;0;0;0
Nebenprodukte Sirup groﬂ to go;0;0;0;0;0;1;0;0;0;0;0;0;0;0;0;0;0;3;0;0;0;0;0;0;0;0;0;0;0;0;0
Preis here;1;0;1;0;3;0;1;0;1;0;2;0;0;1;0;0;1;0;1;1;1;0;0;1;1;2;1;8;1;2;1
Preis to go;0;0;0;1;3;0;0;2;0;1;1;2;0;1;2;0;0;2;3;0;0;1;0;0;0;0;0;3;2;0;1
Shake here;0;0;0;0;0;0;0;0;0;0;0;0;0;0;1;0;0;0;0;0;0;0;0;0;0;0;0;0;0;0;0
Smoothie boost to go;0;0;0;0;0;0;0;0;0;0;0;0;0;0;0;0;0;1;0;0;0;0;1;0;0;0;0;0;0;0;0
Smoothie plain here;2;1;14;9;6;2;9;6;7;7;5;13;3;4;5;3;5;3;7;2;6;2;9;6;6;13;4;6;5;11;3
Smoothie plain to go;3;3;2;6;7;1;7;3;6;4;0;20;5;4;12;2;0;3;4;9;2;8;5;11;17;6;7;6;14;5;0
Softdrink Bionade here;0;2;0;5;1;0;2;1;1;1;1;3;2;1;0;3;0;1;5;3;0;4;2;1;2;8;3;1;3;3;0
Softdrink Bionade to go;0;0;0;0;0;0;0;0;0;0;0;3;0;0;0;0;0;0;0;3;0;1;0;0;1;0;0;0;1;0;0
Softdrink Bottle AFG here;1;4;3;3;7;4;5;5;4;1;3;5;8;6;3;4;3;1;10;5;10;3;6;6;2;18;5;6;4;9;6
Softdrink Bottle AFG to go;0;0;0;1;3;0;1;2;0;1;0;0;0;0;2;1;0;0;3;2;0;0;2;5;4;1;0;1;1;1;0
Softdrink Wasser here;1;3;0;1;7;5;1;1;1;2;1;9;3;0;2;2;0;3;9;3;2;1;0;3;3;6;1;1;0;1;1
Softdrink Wasser to go;0;0;0;0;4;0;0;3;0;0;0;4;1;0;1;1;0;0;0;0;0;0;0;0;3;1;0;1;1;0;1
Special Latte Chocolate Latte here;5;3;4;3;2;1;1;0;4;1;2;3;0;3;2;1;3;3;1;0;1;0;2;3;2;7;2;3;1;1;5
Special Latte Chocolate Latte to go;0;0;0;1;1;1;0;1;0;1;1;1;0;0;0;0;1;0;0;0;1;0;0;1;0;1;0;0;0;0;0
Special Latte Latte Caramel here;5;17;13;9;9;13;10;8;9;10;5;7;5;6;6;7;9;10;11;3;6;3;6;9;4;17;9;14;3;5;11
Special Latte Latte Caramel to go;3;6;1;4;8;0;3;2;1;2;2;5;1;0;6;4;0;0;5;7;5;4;5;4;1;4;4;3;1;0;4
Special Latte Tiramisu Latte here;0;1;1;2;1;1;4;0;1;1;0;3;2;0;0;0;0;1;2;3;1;0;0;0;0;1;5;0;0;0;0
Special Latte Tiramisu Latte to go;0;0;0;0;0;0;0;0;0;0;0;0;0;0;0;1;0;0;1;0;1;0;1;0;2;0;0;0;0;0;1
Special Latte White Banana Chocolate here;3;3;3;2;1;4;3;4;3;0;3;1;4;2;0;1;4;1;1;0;2;0;0;0;4;2;1;2;1;2;3
Special Latte White Banana Chocolate to go;1;0;0;0;0;0;1;0;1;0;0;1;0;0;0;0;0;0;1;3;2;0;0;2;0;1;1;1;0;0;0